id,name,sponsor,event,venue,place,physical_description,notes,occasion,call_number,keywords,language,date,location,location_type,currency,currency_symbol,status
20796,,NEW YORK AND CUBA MAIL STEAMSHIP CO.,BREAKFAST,COMMERCIAL,?,CARD;ILL;4.5X7;,priced wine list on back;flag;,DAILY;,1901-1101,,,1901-01-01,New York And Cuba Mail Steamship Co.,,Dollars,$,under review
26410,,Hotel Drei Konige am Rhein,,HOTEL,Hotel Drei Konige am Rhein,Booklet; 6 x 8.25 inches,dieter zander collection.,,Zander 74,,,,Hotel Drei Konige Am Rhein,,,,complete
20881,,CONGRESS HALL,LUNCHEON,COMMERCIAL,"SARATOGA SPRINGS,NY",BROADSIDE; 5 X 7.25;,"h.s.clement, prop. noted;",,1900-3991,,,1900-08-03,Congress Hall,,,,complete
19643,,,,,,,,,,,,1901-06-07,Norddeutscher Lloyd  Bremen,,,,complete
24978,,SCHWEIZERHOF & LUZERNERHOF,HOCHZEITESSEN VON HERRN RECHTSANWALT MAX GUTTMANN UND FRAULEIN BERTHA LENPOLD,,"LUZERN, SWITZERLAND",FOLDER; ILLUS; COL; 6X8.15;,"german;includes wines served with each course; illustrations of hotel, lake lucerne and alps on covers",,1894-075,,,1894-07-19,Schweizerhof & Luzernerhof,,,,complete
26960,,Humplmayr Grill,,RESTAURANT,Humplmayr Grill,Card; 12.75 x 19 inches,dieter zander collection.,,Zander 360,,,1955-06-10,Humplmayr Grill,,Deutsche Marks,DM,under review
26725,,Agora,,RESTAURANT,Agora,Tri-fold; 9.5 x 14.75 inches folded,dieter zander collection; confectionery and dining; menu decorated with portraits of ladies.,,Zander 516 undated,,,,Agora,,Dollars,$,complete
26719,,Le Bistrot de Maxim's,Dinner,RESTAURANT,Le Bistrot de Maxim's; 680 Madison Avenue,Folder; 7.5 x 11.5 inches; and folder; 5.5 x 7.25 inches,dieter zander collection; larger menu lists dinner appetizers and entrees; smaller menu lists desserts; cartoon on cover.,,Zander 438 undated,,,,Le Bistrot De Maxim's,,Dollars,$,complete
24781,,HAAN'S,LUNCH,COMMERCIAL,PARK ROW BLDG. [NY],CARD; 7 X 10.75;,priced menu; priced wine list on back; note about safety of water; mention of other branches;,,1900-429,,,1900-01-22,Haan's,,Dollars,$,complete
23331,,FIRST AND SECOND COMPANIES GOVERNOR'S FOOT GUARDS,DINNER,PATR;,"HOTEL SOMERSET, BOSTON, MA",BOOKLET; ILLUS; COL; 5.5 X 7.5;,"priced wines, cocktail, and champagne; traditional revolutionary war illustratios; history of companies;",ANNIVERSARY (?);,1906-768,,,1906-10-18,First And Second Companies Governor's Foot Guards,,Dollars,$,complete
14707,,,,,,,,,,,,1900-04-23,Eastern Alumni Of The University Of Chicago,,,,complete
25623,,SOCIETY OF COLONIAL WARS IN THE STATE OF NEW YORK,SEVENTH ANNUAL DINNER,PATR;,"DELMONICO'S,[NEW YORK]",BOOKLET;ILL;COL;5.75X7.5;,"3 copies,one not complete;seating plan attached to copy 1;",ANNIVERSARY;(IN HONOR OF THOSE SERVED IN THE SPANISH AMERICAN WAR),1899-133,,,1899-01-16,Society Of Colonial Wars In The State Of New York,,,,complete
31770,,Waldorf Astoria,,,,16.5x11.5cm folded; 16.5x23cm open,testimonial dinner to s. davies warfield on behalf of the national association of railroad securities,,1920-0121_wotm,,,1920-12-13,Waldorf Astoria,,,,complete
33314,Waldorf Astoria,Waldorf Astoria,,,,,,,1915-0053,,,1915-01-01,Waldorf Astoria,,,,complete
15593,,,,,,,,,,,,1900-05-25,York Hotel,,,,complete
17478,,,,,,,,,,,,1900-02-14,Windsor Hotel,,Dollars,$,complete
20390,,NORDDEUTSCHER LLOYD BREMEN,MITTAGESSEN,COMMERCIAL,"SS ""FRIEDRICH DER GROSSE""",CARD; ILLUS; COL; 5.25X8.25;,"german only; limited choices considering foregoing samples; perhaps this is a menu for another class; illustration of ships in harbor, border of wine bottles, tankards, lobsters; also a postcard;",,1901-2284,,,1901-09-08,Norddeutscher Lloyd Bremen,,,,complete
26147,,GEISER GRAND HOTEL,DINNER,COMMERCIAL,BAKER CITY; OR,FOLDER; ILLUS; COL 5.5 X 7.25;,gray stock; illustration of hotel,,1905-613,,,1905-07-30,Geiser Grand Hotel,,,,complete
24720,,WASHINGTON HIGH SCHOOL CLASS OF '85,EIGHTH ANNUAL REUNION,EDUC;,"HOTEL COCHRAN, [WASHINGTON,D.C.]",BOOKLET; COL; 4.5X6;,"fastened at left by satin ribbon; program including a banjo solo; dance program to be filled in of 8 dances including waltz,polka,lanciers,yorke;toasts listed;",SCHOOL REUNION;,1892-165,,,1892-12-28,Washington High School Class Of '85,,,,complete
26417,,Kronenhalle,,RESTAURANT,Kronenhalle,Plastic sleeve with paper insert; 8 x 11 inches,dieter zander collection; dessert menu.,,Zander 81,,,1976-05-01,Kronenhalle,,Swiss Francs,Fr,complete
19775,,OCEANIC STEAMSHIP CO.,LUNCHEON - SECOND CABIN,COMMERCIAL,EN ROUTE ABOARD SONOMA,CARD; 5.5 X 7;,logo; printed on lighter stock;,,1901-1462,,,1901-05-27,Oceanic Steamship Co.,,,,complete
22085,,HOTEL MARIE ANTOINETTE,BREAKFAST,COMMERCIAL,"SIXTY-SIXTH STREET & BROADWAY, NEW YORK, [NY]",CARD; 5.5X7.5;,cafe menu; priced a la carte;,,1900-594,,,1900-01-29,Hotel Marie Antoinette,,Dollars,$,complete
27059,,Southern Railway System,breakfast,RAILROAD,,11 x 7 in. ; ill.,"event : southern college football games. advertisements : pabst blue ribbon beer, hotel edison, the hotel raleigh, s & w cafeterias, dinkler hotels. manager dining cars : w. f. kusch.",,Soete 180,,,,Southern Railway System,,Dollars,$,complete
13343,,PULLMAN DINING CAR,LUNCH ON TOUR OF THE PRESIDENT TO THE PACIFIC COAST,COMMERCIAL,ON ROUTE,CARD;ILLUS;5.25X7.5;,eagle;tour from 4/29 to 6/15;,PATRIOTIC HOLIDAY;,1901-1303,,,1901-05-01,Pullman Dining Car,,,,complete
20363,,HAMBURG-AMERIKA LINIE,BREAKFAST,COMMERCIAL,SS FURST BISMARCK,FOLDER;4.25X6.25,menu in german and english,DAILY;,1901-1756,,,1901-06-24,Hamburg Amerika Linie,,,,complete
15405,,,,,,,,,,,,1900-08-01,Grand Hotel,,,,complete
13136,,MURRAY HILL HOTEL,BREAKFAST,COMMERCIAL,"(NEW YORK,NY)",CARD;ILL;COL;4.25X6.5;,presented by catharine b.alsop leffingwell written on back;,EASTER;,1900-2791,,,1900-04-15,Murray Hill Hotel,,Dollars,$,complete
25683,,HOTEL ALCAZAR,LUNCHEON,COMMERCIAL,"ST. AUGUSTINE, FL",CARD; COL; 4 X 7.5;,blue stock; note about purity of water;,,1901-709,,,1901-03-20,Hotel Alcazar,,,,complete
27245,,The Waldorf-Astoria,dinner,HOTEL,The Waldorf-Astoria,folder; 9.8 x 12.75 inches,baratta collection; room service; a la carte; marcel (head waiter); room service charge 50 cents per person; specials; waldorf special,,Baratta 24,,,1959-11-24,The Waldorf Astoria,,Dollars,$,complete
20878,,STEAMER TICONDEROGA,DINNER,COMMERCIAL,"LAKE GEORGE,NY",BROADSIDE; ILLUS. BORDER; 4.75 X 7.5;,menu handwritten & price included;,,1900-3986,,,1900-08-02,Steamer Ticonderoga,,,,complete
24719,,MASSACHUSETTS SOCIETY OF COLONIAL WARS,14TH ANNUAL DINNER,SOC;,SOMERSET HOTEL[MASS],FOLDER;ILLUS;COL;5X7;,wines included;,ANNIVERSARY;,1907-540,,,1924-07-05,Massachusetts Society Of Colonial Wars,,,,complete
33485,U.S.S. New York (?),U.S.S. New York (?),,,,,,,1915-0224,,,1915-01-01,U.S.S. New York (?),,,,complete
21335,,KING FREDERIK VIII,NEW YEAR'S DINNER TO THE DIPLOMATIC CORPS AND THEIR LADIES,GOVT;,"PALACE OF CHRISTIAN VII, COPENHAGEN, DENMARK",CARD; ILLUS; COL; 4.5X6.75;,"menu in french; spon, evnt, pl noted by feb;",COMPLIMENTARY/TESTIMONIAL,1907-017,,,1907-01-02,King Frederik Viii,,,,complete
27522,,Norddeutscher Lloyd Bremen,Lunch A La Carte,,,,,,1910-822,,,1910-03-14,Norddeutscher Lloyd Bremen,,,,complete
34155,Gutmann's Café and Restaurant,Gutmann's Café and Restaurant,,,,28x17.5cm,,,1914-0857_wotm,,,1914-08-31,Gutmann's Café and Restaurant,,Dollars,$,complete
29867,,Hotel Commodore,,,,21.5x14cm folded; 21.5x28cm open,rotary club of new york,,1947-0019_wotm,,,1947-04-24,Hotel Commodore,,Dollars,$,complete
33309,The Plaza,The Plaza,,,,,,,1915-0048,,,1915-01-01,The Plaza,,,,complete
31010,,Raffles Hotel,,,,26x19cm folded; 26.38cm open,arthur h. rumpf menu collection,,1938-0145_wotm,,,1938-08-01,Raffles Hotel,,Straits dollar (1904-1939),$,complete
13015,,PACIFIC MAIL STEAMSHIP COMPANY,DINNER,COM,[SS CITY OF RIO DE JANEIRO],FOLDER; 5.75X8.75,"2 copies; ""city of rio de janiero"" printed on second copy;",DAILY,1900-3099,,,1900-05-04,Pacific Mail Steamship Company,,,,complete
23285,,HAMBURG-AMERIKA LINIE,CARTE DU JOUR,COMMERCIAL,"RITZ CARLTON RESTAURANT AN BORD DER ""AMERIKA""",CARD; ILLUS; COL; 8.75X12.75;,a la carte menu in french; menu handwritten in violet ink; decorative flower border; one of several menus for different passenger classes on this ocean liner; [date info supplied by feb];,,1906-635,,,1906-07-25,Hamburg Amerika Linie,,Deutsche Marks,DM,complete
30328,,Waldorf Astoria,,,,18x12cm folded; 18x24cm open,cornell university medical college alumni association,,1939-0089_wotm,,,1939-04-20,Waldorf Astoria,,,,complete
31598,,[Restaurant Name And/Or Location Not Given],,,,29x18.5cm,,,1927-0031_wotm,,,1927-02-24,[Restaurant Name And/Or Location Not Given],,Dollars,$,complete
29581,,The Plaza   Ballroom,,,,24x16.5cm folded; 24x33cm open,,,1955-0128_wotm,,,1955-10-06,The Plaza   Ballroom,,,,complete
12780,,HAMBURG-AMERIKA LINIE,DAILY MENU,COMMERCIAL,"SCHNELLDAMPFERS ""AUGUST VICTORIA""",CARD; ILLUS; COL; 9X7;,german & french; concert program included; harbour scene on front of menu;,,1900-1011,,,1900-02-12,Hamburg Amerika Linie,,,,under review
22409,,MUSICAL MUTUAL PROTECTIVE UNION OF N.Y. (LOCAL NO. 1),DINNER TO THE DELEGATES OF THE NATIONAL LEAGUE OF MUSICIANS,PROF;,"DELMONICO'S, NEW YORK, NY",PAMPHLET; ILLUS; 7.50 X 5.75;,"includes wines served with individual courses; silk ribbon attachments; musical notes on cover, national league of musicians of u.s. emblem on back cover;",COMPLIMENTARY/TESTIMONIAL,1892-045,,,1892-03-18,Musical Mutual Protective Union Of N.Y. (Local No. 1),,,,complete
20615,,TOYO KISEN KAISHA,DINNER,COMMERCIAL,EN ROUTE ABOARD HONG KONG MARU,BROADSHEET; ILLUS; 6.5 X 7.75;,"b&w photographs of various points of interest in america, hawaii, china;japan;",DAILY MENU;,1900-4684,,,1900-10-13,Toyo Kisen Kaisha,,,,complete
26945,,Wilder Mann Ruckersdorf,,"HOTEL,RESTAURANT",Wilder Mann Ruckersdorf,Tri-fold; 6.25 x 12.5 inches,dieter zander collection.,,Zander 325 undated,,,2012-12-04,Wilder Mann Ruckersdorf,,Deutsche Marks,DM,complete
12662,,,,,,,,,,,,1900-03-30,Ancient & Accepted Scottish Rite  (Masonic Lodge),,,,complete
23597,,PROFILE HOUSE AND HOTEL VENDOME,DINNER,COMMERCIAL,"BOSTON,MASS",FOLDER;ILL;COL;3.5X6;,,DAILY;,1899-568,,,1899-09-08,Profile House,,,,complete
20918,,NIPPON YUSEN KAISHA,DINNER,COMMERCIAL,EN ROUTE ABOARD SS. KASUGA,BROADSHEET; COL; ILLUS; 10.25 X 9.5;,handwritten; color illustraion of children carrying lanterns and large drum;  map of steamship routes on back;,DAILY MENU;,1900-4544,,,1900-10-01,Nippon Yusen Kaisha,,,,complete
14325,,THE COMMERCIAL CLUB,FOURTH ANNUAL BANQUET,SOC;,"SALT LAKE CITY, UT",BOOKLET; ILLUS; COL; 10.25X7.5;,"wines listed with course; some utah resources, music, toasts, officers and directors and banquet committee listed, each on a separate titled page;",ANNIVERSARY;,1905-1044,,,1905-12-28,The Commercial Club,,Dollars,$,complete
25359,,ROYAL PALM HOTEL,DINNER,COM,"MIAAMI BISCAYNE BAY,FLA.",BROADSHEET; HOTEL EMBLEM; COL; 4.5 X 8;,list of local fish on back;,,1901-746,,,1901-03-24,Royal Palm Hotel,,,,complete
23934,,HOTEL COLONIAL,DINNER,COMMERCIAL,"NASSAU, THE BAHAMAS",CARD; COL; 5 X 9;,logo; blue stock;,,1901-196,,,1901-01-27,Hotel Colonial,,,,complete
28142,,Pan American,,,,22x16cm folded; 22x32cm open,,,1967-0046_wotm,,,1967-08-28,Pan American,,Dollars,$,complete
20004,,HOTEL VICTORY,BREAKFAST,COMMERCIAL,"PUT-IN-BAY-ISLAND, LAKE ERIE, OH;",BROAADSIDE; 4.5X6.75;,,,1900-4142,,,1900-08-23,Hotel Victory,,,,complete
31622,,"S.S. ""Republic""""""",,,,21x16cm folded; 21x32cm open,,,1927-0022_wotm,,,1927-10-02,"S.S. ""Republic""""""",,,,complete
32768,Hotel Marlborough,Hotel Marlborough,,,,33x18cm,,,1917-0505_wotm,,,1917-11-16,Hotel Marlborough,,Dollars,$,complete
32661,Healy's Forty-second Street restaurant,Healy's Forty-second Street restaurant,,,,33x18cm,dinner,,1918-0381_wotm,,,1918-03-22,Healy's Forty-second Street restaurant,,Dollars,$,complete
33570,Waldorf Astoria,Waldorf Astoria,,,,20x14cm folded; 20x28cm open,cornell university,,1914-0029_wotm,,,1914-01-10,Waldorf Astoria,,,,complete
26950,,Landliche Hotel,,"HOTEL,RESTAURANT",Watzenhof,Booklet; 9.25 x 13 inches,dieter zander collection.,,Zander 338 undated,,,,Landliche Hotel,,,,complete
30288,,Waldorf Astoria,,,,25.5x18cm folded; 25.5x36cm open,the paper and twine club,,1939-0049_wotm,,,1939-02-22,Waldorf Astoria,,,,complete
21200,,MARSHAL OLIVEIRA OF THE BRAZILIAN COMMISSION,WORLD'S COLUMBIAN EXPOSITION DINNER,GOVT;,METROPOLE HOTEL [CHICAGO IL?],BOOKLET; ILLUS; COL; 5.25 X 7;,"newpaper clipping only; red, whte and blue ribbons and flag; gold medallion",OTHER (MEETING),1893-031,,,1893-01-01,Marshal Oliveira Of The Brazilian Commission,,,,complete
17481,,,,,,,,,,,,1900-02-14,Usms St Louis,,,,complete
34454,Hotel McAlpin,Hotel McAlpin,,,,17.5x10cm,pan-american states association,,1913-0077_wotm,,,1913-01-22,Hotel McAlpin,,,,complete
20398,,HAMBURG-AMERIKA LINIE,BREAKFAST,COMMERCIAL,SS FURST BISMARCK,FOLDER; ILLUS; COL; 4.25X6.25;,menu in german and english; emblem on back cover;,DAILY;,1901-1918,,,1901-07-09,Hamburg Amerika Linie,,,,complete
26457,,Gambrinus,,RESTAURANT,Gambrinus,Folder; 5 x 12.5 inches,dieter zander collection.,,Zander 125,,,1977-02-01,Gambrinus,,,,complete
21644,,DENNIS HOTEL,EASTER SUNDAY LUNCHEON,COMMERCIAL,"ATLANTIC CITY, NJ",BOOKLET; ILLUS; COL; 4.25X6.5;,"includes musical program of instrumental, vocal, & popular gospel song service for later easter sunday evening; lily & hotel seal embossed on cover; silk cord attachment;",RELIGIOUS HOLIDAY,1899-289,,,1899-04-02,Dennis Hotel,,,,complete
33398,Restaurant name and/or location not given],Restaurant name and/or location not given],,,,,,,1915-0137,,,1915-01-01,Restaurant name and/or location not given],,Dollars,$,complete
17270,,,,,,,,,,,,1900-01-01,Hotel De France,,,,complete
15773,,,,,,,,,,,,1901-05-10,Norddeutscher Lloyd  Bremen,,,,complete
31415,,Hotel Pierre,,,,34x21.5cm,pierre roof dejeuner,,1933-0323_wotm,,,1933-06-05,Hotel Pierre,,Dollars,$,complete
33915,Hotel Cape May,Hotel Cape May,,,,24x17cm folded; 24x34cm open,maryland bankers association,,1914-0616_wotm,,,1914-06-18,Hotel Cape May,,,,complete
26277,,HOTEL ST. REGIS,"DAILY MENU, LUNCHEON",COMMERCIAL,"NEW YORK, NY",CARD; 5X8;,menu in english on one side and french on the back side;,,1905-774,,,1905-10-23,Hotel St. Regis,,Dollars,$,under review
22866,,TAMPA BAY HOTEL,LUNCHEON,COMMERCIAL,"TAMPA,FLA.",BROADSIDE; ILLUS; 4.5 X 7.25;,,,1901-129,,,1901-01-20,Tampa Bay Hotel,,,,complete
27505,,"The Rochester Chamber Of Commerce Convention Hall, Dinner.",Dinner,,,,,,1910-933,,,1910-03-18,"The Rochester Chamber Of Commerce Convention Hall, Dinner.",,,,complete
28139,,S.S. Prince George,,,,20x13cm folded; 20x26cm open,,,1967-0043_wotm,,,1967-08-15,S.S. Prince George,,,,complete
20499,,NIPPON YUSEN KAISHA,DINNER,COMMERCIAL,EN ROUTE ABOARD SS. KASUGA,BROADSHEET; COL; ILLUS; 10.25 X 9.5;,handwritten; color illustraion of children carrying lanterns and large drum;  map of steamship routes on back;,DAILY MENU;,1900-4678,,,1900-10-12,Nippon Yusen Kaisha,,,,complete
24295,,STATEN ISLAND ATHLETIC CLUB,DECENNIAL CELEBRATION,SOC;,"WEST NEW BRIGHTON, STATEN ISLAND, NY",CARD; ILLUS; 4X6; COL;,gold border;wine list; raised silver print and siluouette of woman,SOC;,1887-025,,,1887-09-05,Staten Island Athletic Club,,Dollars,$,complete
15722,,,,,,,,,,,,1901-05-09,National Board Of Fire Underwriters,,,,complete
20712,,HAMBURG-AMERIKA LINIE,DINNER,COMMERCIAL,SS AUGUSTE VICTORIA,FOLDER;ILL;COL;4.5X7;,separate german and english menu listings;musical program;numerous illustrations;,DAILY;,1900-2651,,,1900-04-02,Hamburg Amerika Linie,,,,complete
34420,Waldorf Astoria,Waldorf Astoria,,,,28x17.5cm folded; 28x35cm open,holland society of new york,,1913-0043_wotm,,,1913-01-16,Waldorf Astoria,,,,complete
33826,Broadway Auditorium,Broadway Auditorium,,,,18x14cm folded; 18x28cm open,buffalo orpheus carnival masquerade,,1914-0283_wotm,,,1914-02-23,Broadway Auditorium,,Dollars,$,complete
31877,,Hotel Vancouver,,,,28.5x18cm,,,1921-0058_wotm,,,1921-07-01,Hotel Vancouver,,Canadian Dollars,C$,under review
13124,,,,,,,,,,,,1900-02-16,Cunard Line,,Shillings,s,complete
27997,,The Union League Club,,,,21.5x14cm folded; 21.5x27.5cm open,,,1976-0013_wotm,,,1976-09-13,"The Wine And Food Society, Incorporated, New York",,,,complete
25748,,COMPAGNIE GENERAL TRANSATLANTIQUE,DINNER,COMMERCIAL,ABOARD PAQUEBOT LA SAVOIE,CARD; ILLUS; COL; 6 X 8;,menu in french and english; photos of steamer and chateau; nautical flags;,,1906-678,,,1906-08-23,Compagnie General Transatlantique,,,,complete
22358,,CHAMBERLIN HOTEL,BREAKFAST,COMMERCIAL,"OLD POINT COMFORT, VA.",BROADSIDE; ILLUS; COL; 4.5 X 7;,,DAILY,1899-806,,,1899-12-08,Chamberlin Hotel,,,,complete
25108,,CHILDS',DAILY MENU,COMMERCIAL,NEW YORK,CARD; COL; ILLUS; 6X10;,priced menu; yellow stock; ornamental lettering;,,1907-562,,,1907-06-01,Childs',,Dollars,$,complete
32343,Wm. F. Healy's 42nd St. Grill,Wm. F. Healy's 42nd St. Grill,,,,20.5x13cm,,,1918-0219_wotm,,,1918-02-23,Wm. F. Healy's 42nd St. Grill,,Dollars,$,complete
24108,,N.Y.&P.R.S.S.CO. - U.S.M.S. COAMO,LUNCHEON,COMMERCIAL,EN ROUTE,BROADSIDE; FLAG EMBLEM; 4.5X6.5;,,DAILY,1905-574,,,1905-07-16,N.Y.&P.R.S.S.Co.   U.S.M.S. Coamo,,,,complete
33140,Hotel Belmont,Hotel Belmont,,,,16.5x21.5cm,,,1917-0632_wotm,,,1917-11-23,Hotel Belmont,,Dollars,$,complete
23500,,COMRADES OF THE ARMY OF THE POTOMAC,"DINNER TO CAPT. LOUIS PHILIPPE D'ORLEANS, COMTE DE PARIS",MIL;,"PLAZA HOTEL, NY",CARD FOLDER; COL; ILLUS; 4.5 X 7;,"embossed red, white, blue medal; tied with white ribbons; menu also a place card for lt. s.h. robbins; french;",COMPLIMENTARY/TESTIMONIAL,1890-093,,,1890-10-20,Comrades Of The Army Of The Potomac,,,,under review
34312,The Pioneer Limited,The Pioneer Limited,,,,21x14cm,,,1914-1014_wotm,,,1914-11-07,The Pioneer Limited,,Dollars,$,complete
12858,,HOTEL WASHINGTON,DAILY MENU,COMMERCIAL,"JERSEY CITY, NY",FOLDER; 7 X 11;,priced menu; priced wine list; handwritten insert,,1900-2445,,,1900-03-14,Hotel Washington,,Dollars,$,under review
17942,,,,,,,,,,,,1901-05-16,The Ladies Of The Ohio Society Of California,,,,complete
20366,,OCEANIC STEAMSHIP COMPANY,BREAKFAST,COMMERCIAL,"SS SONOMA,SECOND CABIN",CARD;ILLUS;COL;5.5X7;,flag;,DAILY;,1901-1759,,,1901-06-24,Oceanic Steamship Company,,,,complete
35332,Adam's Restaurant,Adam's Restaurant,,,,,stevens institute of technology,,1913-0560_wotm,,,1913-11-06,Adam's Restaurant,,Dollars,$,complete
34844,Chemists' Club,Chemists' Club,,,,,american institute of chemical engineers,,1912-0565_wotm,,,1912-05-09,Chemists' Club,,,,complete
22134,,LAKE VIEW HOUSE,DINNER,,AUSABLE CHASM NY,FOLDER; ILLUS; 5.5 X 8.5,handwritten; illus of hotel and fruit basket; wine list,,1881-031,,,1881-09-06,Hotel Kaaterskill,,Dollars,$,complete
34831,Plankinton House,Plankinton House,,,,,american bar association,,1912-0552_wotm,,,1912-08-29,Plankinton House,,,,complete
20595,,OCCIDENTAL & ORIENTAL STEAMSHIP CO.,BREAKFAST,COMMERCIAL,SS GAELIC,BROADSIDE;ILL;COL;5.5X8.5;,handwritten items of printed form;flag;2 copies,DAILY;,1900-3563,,,1900-06-07,Occidental & Oriental Steamship Co.,,,,complete
33784,The Blackstone,The Blackstone,,,,20.5x15.5cm folded; 20.5x31cm open,commercial club of chicago,,1914-0241_wotm,,,1914-02-14,The Blackstone,,,,complete
15924,,,,,,,,,,,,1900-12-14,Columbia College Students,,,,complete
30576,,The Hotel Vancouver,,,,28x20.5cm folded; 28x41cm open,,,1937-0051_wotm,,,1937-03-09,The Hotel Vancouver,,Canadian Dollars,C$,complete
14988,,,,,,,,,,,,1900-03-05,Occidental & Oriental Steamship Co.,,,,complete
31422,,The Ambassador,,,,33x23cm,,,1933-0330_wotm,,,1933-06-01,The Ambassador,,Dollars,$,complete
21519,,CUNARD LINE-R.M.S. PAVONIA,BREAKFAST,COMMERCIAL,[EN ROUTE],BROADSHEET; 4.5 X  6X5;,"handwritten in colored ink;prices for all wines,liquors & cigarettes printed on back;",,1896-176,,,1896-10-02,Cunard Line R.M.S. Pavonia,,,,complete
24999,,STANTON HOUSE,ST. VALENTINE'S DAY DINNER,COMMERCIAL,"CHATTANOOGA, TN",BOOKLET; ILLUS; COL; 4.5X6;,red hearts on cover;,SECULAR HOLIDAY;,1901-364,,,1901-02-14,Stanton House,,,,complete
31517,,Hotel Carls Rite,,,,16x22.5cm,menu is ripped,,1928-0006_wotm,,,1928-10-29,Hotel Carls Rite,,Dollars,$,complete
31808,,The Hudson,,,,26x24cm,christmas in dickens' day,,1925-0027_wotm,,,,The Hudson,,,,complete
30516,,The Latch String,,,,24.5x16.5cm folded; 24.5x32.5cm open,,,1941-0063_wotm,,,1941-09-30,The Latch String,,Dollars,$,complete
35492,Hotel Sherman,Hotel Sherman,,,,,5 images,,1913-0723_wotm,,,1913-09-18,Hotel Sherman,,,,complete
16521,,PACIFIC MAIL STEAMSHIP COMPANY,DINNER,COMMERCIAL,SS: RIO DE JANEIRO,FOLDER; ILLUS; 5.5X8.5;,handwritten in lavendar ink & then printed; decorative border & sketch of steamship;,,1900-3770,,,1900-07-01,Pacific Mail Steamship Company,,,,complete
20185,,NIPPON YUSEN KAISHA - S.S.KASUGA,BREAKFAST,COMMERCIAL,EN ROUTE,BROADSIDE; ILLUS BORDER; 5.25 X 7.75;,menu handwritten;,,1900-4647,,,1900-10-09,Nippon Yusen Kaisha   S.S.Kasuga,,,,complete
31767,,The Gridiron Club,,,,22x13.5cm,,,1920-0118_wotm,,,1920-12-11,The Gridiron Club,,,,complete
34975,Waldorf Astoria,Waldorf Astoria,,,,,american institute of mining engineers,,1913-0202_wotm,,,1913-02-19,Waldorf Astoria,,,,complete
20777,,NIPPON YUSEN KAISHA,BREAKFAST,COMMERCIAL,EN ROUTE ABOARD SS. KASUGA,BROADSIDE; 5.5 X 7.75;,handwritten; green border;,DAILY,1900-4800,,,1900-10-26,Nippon Yusen Kaisha,,,,complete
18059,,,,,,,,,,,,1900-10-22,Hotel Grunewald,,Dollars,$,under review
26262,,,,,,,,,,,,1896-10-23,Club,,Dollars,$,under review
18196,,,,,,,,,,,,1900-05-26,Marshall A.Newell,,,,under review
19980,,HOTEL NETHERLAND,BREAKFAST,COMMERCIAL,NEW YORK,BOOKLET; 3 X 4;,booklet contains prix fixe menus ranging in price from sixty cents to one dollar; the booklet is titles individual club breakfasts and states that meal is served to one person only;,,1900-2907,,,1900-04-16,Hotel Netherland,,Dollars,$,complete
30064,,Texas Zephyrs,,,,23x15.5cm folded; 23x30.5cm open,railroad dining car menu,,1943-0026_wotm,,,1943-01-01,Texas Zephyrs,,Dollars,$,complete
28049,,Air France,,,,21x15cm folded; 21x30cm open,,,1978-0014_wotm,,,1978-06-19,Air France,,,,complete
23353,,HOTEL MEN'S MUTUAL BENEFIT ASSOCIATION OF THE UNITED STATES,SEVENTEENTH ANNUAL DINNER,COMMERCIAL,"HOTEL DEL CORONADO, SAN DIEGO COUNTY, CA",BOOKLET; ILLUS; COL; 7.5X9;,"includes wines served with individual courses; lists toasts & committees; decorative flowers on cover, seal on back page; silk ribbon attchement;",ANNIVERSARY;,1896-143,,,1896-01-01,Hotel Men's Mutual Benefit Association Of The United States,,,,complete
29231,,Peacock Alley,,,,26x10.5cm folded; 49x10.5cm open,french is secondary language,,1995-0003_wotm,,,1995-11-02,Peacock Alley,,,,complete
24826,,ROYAL POINCIANA HOTEL,LUNCHEON,COM,"PALM BEACH,FLA.",BROADSIDE; HOTEL EMBLEM; 4 X 7.5;,,,1901-611,,,1901-03-08,Royal Poinciana Hotel,,,,complete
14884,,,,,,,,,,,,1900-02-22,Manhattan Hotel,,,,complete
13504,,GRISWOLD HOUSE,LUNCHEON,COMMERCIAL,"DETROIT, MI",CARD; COL; 4.25 X 7;,pale blue; logo;,DAILY MENU,1900-4770,,,1900-10-21,Griswold House,,,,complete
27113,,Southern Pacific,lunch,RAILROAD,"Dining Car, Southern Pacific",8 1/2 x 5 1/2 in. fold. ; ill. col.,"photographic illustration : southern arizona desert. manager : harry a. butler includes ""select"" and a la carte menu options.",,Soete 100,,,1942-01-01,Southern Pacific,,Dollars,$,complete
33232,Wm. F. Healy's 42nd St. Grill,Wm. F. Healy's 42nd St. Grill,,,,20x13cm,,,1917-0982_wotm,,,1917-12-21,Wm. F. Healy's 42nd St. Grill,,Dollars,$,complete
18217,,,,,,,,,,,,1900-10-07,Nippon Yusen Kaisha,,,,complete
15731,,,,,,,,,,,,1901-05-25,Oceanic Steamship Co.,,,,complete
28760,,The American Harvest Restaurant,,,,38x27cm folded; 38x55cm open,,,1987-0020_wotm,,,1987-01-01,The American Harvest Restaurant,,,,complete
22290,,IMPERIAL (?),[DINNER],[SOC],"ST.LOUIS CLUB, ST.LOUIS,MO.",BROADSIDE; 3.5 X 4.5;,menu in french;,,1901-238,,,1901-02-01,Imperial (?),,,,complete
28463,,S.S. Maasdam,,,,25x12.5cm,,,1958-0111_wotm,,,1958-12-27,S.S. Maasdam,,Dollars,$,complete
15231,,,,,,,,,,,,1900-09-05,Brown Palace,,Dollars,$,complete
27579,,Norddeutscher Lloyd Bremen,Souper Sic,,,,,,1910-968 Item D,,,1910-03-19,Norddeutscher Lloyd Bremen,,,,complete
29880,,Louis Sherry,,,,33x25.5cm folded; 33x51cm open,,,1947-0032_wotm,,,1947-07-04,Louis Sherry,,Dollars,$,complete
22083,,ST. REGIS HOTEL,LUNCHEON/DEJEUNER FOURCHETTE,COMMERCIAL,"NEW YORK, NY",CARD; 5X8;,french and english;,,1906-214,,,1906-02-21,St. Regis Hotel,,Dollars,$,complete
30210,,S.S. Columbus,,,,21x14cm folded; 21x28cm open,menu also translated into english,,1939-0162_wotm,,,1939-08-30,S.S. Columbus,,,,complete
25513,,CHILDS',DAILY LUNCH MENU,COMMERCIAL,"42 EAST 14TH STREET, 440 BWAY, NEW YORK",FOLDER; 6X10;,priced menu; place noted by feb; branches listed;,,1907-563,,,1907-06-01,Childs',,Dollars,$,complete
32983,Childs,Childs,,,,23x20.5cm,,,1917-0723_wotm,,,1917-11-30,Childs,,Dollars,$,complete
28155,,The Connecticut Room Hartford Plaza Building,,,,29.5x21.5cm folded; 29.5x43cm open,,,1966-0003_wotm,,,1966-01-18,The Connecticut Room Hartford Plaza Building,,,,complete
30162,,"Harry M. Stevens, Inc   Caterers",,,,21x14cm folded; 21x28cm open,,,"1939-0114; two copies, please digitize c",,,1939-05-25,"Harry M. Stevens, Inc   Caterers",,Dollars,$,complete
13429,,UNIVERSITY CLUB,DINNER TO BROWN UNIVERSITY DEBATING TEAMS,EDUC;,"[PROVIDENCE, R.I.]",CARD; 5X7.25;,[place info supplied by feb];,COMPLIMENTARY/TESTIMONIAL,1900-3321,,,1900-05-19,University Club,,,,complete
16168,,,,,,,,,,,,1901-07-21,Nippon Yusen Kaisha   S.S.Rosetta Maru,,,,complete
22178,,TENNESSEE CENTENNIAL EXPOSITION,DINNER,COMMERCIAL,[SR RR]ENROUTE NASHVILLE TO WASHINGTON [DC],CARD;5.5X7.5;,,COMPLIMENTARY/TESTIMONIAL,1897-191,,,1897-06-14,Tennessee Centennial Exposition,,,,complete
32681,The Biltmore,The Biltmore,,,,28x18cm folded; 28x36cm opened,,,1917-0418_wotm,,,1917-11-13,The Biltmore,,Dollars,$,complete
29003,,Commerce Club,,,,26x21cm folded; 26x42cm open,,,1964-0004_wotm,,,1964-03-04,Commerce Club,,,,complete
