id,name,sponsor,event,venue,place,physical_description,notes,occasion,call_number,keywords,language,date,location,location_type,currency,currency_symbol,status
28680,,Janssen's Restaurant,,,,36.5x23cm folded; 36.5x56cm open,,,1959-0041_wotm,,,1959-08-14,Janssen's Restaurant,,Dollars,$,complete
19223,,,,,,,,,,,,1901-06-03,Oceanic Steamship Company,,,,complete
19728,,CUNARD LINE,DINNER,COMMERCIAL,RMS CAMPANIA,CARD;ILL;COL;4.25X6.5;,flag;priced wine list on back;,DAILY;,1900-2237,,,1900-03-02,Cunard Line,,,,under review
16671,,NIPPON YUSEN KAISA,BREAKFAST,COMMERCIAL,EN ROUTE - SS KAIRGA,BROADSIDE; ILLUS;  5.5 X 7.5;,menu handwritten;,DAILY;,1900-4080,,,1900-08-18,Nippon Yusen Kaisa,,,,complete
20275,,CUNARD LINE,LUNCHEON,COMMERCIAL,"R.M.S. ""ETRURIA""",CARD; ILLUS; COL; 4.25X6.5;,steamship co. priced wine list on back; company flag at top of menu;,,1900-2274,,,1900-03-04,Cunard Line,,,,complete
15542,,,,,,,,,,,,1901-04-26,Cosmopolitan Hotel,,Dollars,$,complete
29432,,El 91,,,,23.5x16cm folded; 23.5x32.5cm open,,,1953-0039_wotm,,,1953-01-01,El 91,,Sol,S/.,complete
12614,,,,,,,,,,,,1900-04-21,Knights Of Revelry,,,,complete
29015,,Simpson's In The Strand,,,,27x17.5cm folded; 27x35cm open,,,1964-0019_wotm,,,1964-07-22,Simpson's In The Strand,,,,complete
19842,,HAMBURG-AMERIKA LINIE,DINNER,COMMERCIAL,EN ROUTE ABOARD SCNELLDAMPFER (EXPRESS STEAMER) AUGUSTE VICTORIA,CARD; COL; ILLUS; 9 X 7;,german and english; musical program; illustration of steamer with azores in the background;,,1900-2595,,,1900-03-27,Hamburg Amerika Linie,,,,complete
33798,Hotel Schenley,Hotel Schenley,,,,24x17cm folded; 24x34cm open,,,1914-0255_wotm,,,1914-02-19,Hotel Schenley,,,,complete
21621,,L. LAFLIN KELLOGG,DINNER TO [GEORGE C. CLARK],SOCIAL,COLONIAL CLUB OF NY,BROADSIDE; ILLUS; 4.75 X 7;,wines listed for each course;,COMPLIMENTARY/TESTIMONIAL,1898-022,,,1898-01-10,L. Laflin Kellogg,,,,complete
20885,,CANADIAN PACIFIC RAILWAY,BREAKFAST,COMMERCIAL,DINING CAR SERVICE,CARD; ILLUS; COL; 4.75X6.75;,"""meals 75 cents;"" photo of place viger hotel, montreal on back of menu;",,1900-3667,,,1900-06-01,Canadian Pacific Railway,,,,complete
14208,,OCEANIC STEAMSHIP COMPANY - SIERRA,DINNER,COM,EN ROUTE,BROADSIDE; EMBLEM; 5.25 X 8.5;,menu handwritten;,,1901-1968,,,1901-07-20,Oceanic Steamship Company   Sierra,,,,complete
17603,,,,,,,,,,,,,Mills Hotel Restaurant,,Dollars,$,complete
31624,,National Vaudeville Artists Club,,,,19x14cm folded; 19x28cm open,menu is fragile,,1927-0024_wotm,,,1927-12-08,National Vaudeville Artists Club,,,,complete
14249,,OCEANIC STEAMSHIP COMPANY,LUNCHEON,COMMERCIAL,SS ZEALANDIA,CARD; ILLUS; COL; 5.5X7;,flag;,DAILY;,1901-2187,,,1901-08-22,Oceanic Steamship Company,,,,complete
30244,,Waldorf Astoria,,,,20x13.5cm,"national association of blouse manufacturers, inc",,1939-0005_wotm,,,1939-01-09,Waldorf Astoria,,,,complete
20167,,NIPPON YUSEN KAISHA,TIFFIN,COMMERCIAL,EN ROUTE ABOARD SS. KASUGA,BROADSIDE; 5.5 X 7.75;,handwritten; green border;,DAILY,1900-4751,,,1900-10-19,Nippon Yusen Kaisha,,,,complete
22962,,GERMAN UNION LOGE,75TH ANNIVERSARY BANQUET AND BALL,SOC;,"TEUTONIA ASSEMBLY ROOMS, [NEW YORK, N.Y.]",FOLDER; ILL; 4.75X7.5;,toasts in german; all other material except menu in german; names listed;front cover with masonic lodge insignia and sparkled spattered lettering;,ANNIVERSARY;,1894-038,,,1894-04-14,German Union Loge,,,,complete
32877,Delmonicos,Delmonicos,,,,30.5x22cm,,,1917-0179_wotm,,,1917-10-27,Delmonicos,,Dollars,$,complete
32952,Fleischmann's Vienna Restaurant,Fleischmann's Vienna Restaurant,,,,30.5x19.5cm,,,1917-0692_wotm,,,1917-11-26,Fleischmann's Vienna Restaurant,,Dollars,$,complete
21667,,FORDHAM UNIVERSITY ALUMNI ASSOCIATION,ANNUAL DINNER,EDUC;,DELMONICO'S [NEW YORK],BOOKLET; O;;IS; COL; 9.5 X 9.75;,wines with each course; maroon seal; toasts;,ANNIVERSARY;,1907-061,,,1907-01-10,Fordham University Alumni Association,,,,complete
16286,,,,,,,,,,,,1905-12-30,Fraternity Of Delta Psi,,,,complete
34310,Waldorf Astoria,Waldorf Astoria,,,,14.5x20cm,,,1914-1012_wotm,,,1914-11-06,Waldorf Astoria,,Dollars,$,complete
14265,,NORDDEUTSCHER LLOYD BREMEN,[LUNCH] SPEISE-KARTE,COM,"EN ROUTE - ""FRIEDRICH DER GROSSE""",BROADSIDE; ILLUS; COL; 5.5 X 8.25;,menu in german only;,,1901-2326,,,1901-09-13,Norddeutscher Lloyd Bremen,,,,complete
23877,,BELLECLAIRE CLUB,DINNER,SOC;,"[NEW YORK, NY]",BOOKLET; ILLUS; COL; 5.6X8.6;,includes wines served with individual courses; [place info supplied by feb]; photograph on cover of young woman with elaborate hairdo; silver decoration;,,1906-350,,,1906-03-31,Belleclaire Club,,,,complete
19857,,NORDDEUTSCHER LLOYD BREMEN,LUNCH,COMMERCIAL,EN ROUTE ABOARD KAISER WILHELM DER GROSSE,CARD; ILLUS; 5.5 X 8;,menu in german and english; illustration of sailing ship and cliffs; suitable for mailing;,,1900-2772,,,1900-04-13,Norddeutscher Lloyd Bremen,,,,complete
13719,,NIPPON YUSEN KAISHA - S.S. KASUGA,DINNER,COM,EN ROUTE,BROADSHEET; ILLUS OF JAPANESE CHILDREN IN COLOR; 10.25 X 9.75;,menu handwritten; map on back showing the route;,,1900-4649,,,1900-10-09,Nippon Yusen Kaisha   S.S. Kasuga,,,,complete
22727,,SONS OF THE REVOLUTION,CELEBRATION OF THE EVACUATION OF THE CITY OF NEW YORK,PATR,DELMONICO'S [NEW YORK],CARD; 4.25X6.75,"french menu; complete verses of the songs america and columbia, the gem of the ocean printed on the back cover",OTHER,1891-119,,,1891-11-25,Sons Of The Revolution,,,,complete
21066,,THIRD PANEL SHERIFF'S JURY,ANNUAL DINNER,GOVT;,DELMONICO'S [NY],ILLUS; CARD FOLDER; 6.5 X 8.25;,cherub; grapes; wines;,0THER (ANNIV),1895-037,,,1895-02-14,Third Panel Sheriff's Jury,,,,complete
25677,,'95 LAW OF COLUMBIAN UNIVERSITY,JUNIOR BANQUET,EDUC;,HOTEL ARNO,BOOKLET; ILL; 4.75X7;,"toasts listed, names of officers and committee listed; fastened in two places on top with twisted cord;",,1894-060,,,1894-05-22,'95 Law Of Columbian University,,,,complete
30004,,Chicago And North Western System,,,,25.5x19cm folded; 25.5x38cm open,,,1948-0015_wotm,,,1948-02-15,Chicago And North Western System,,Dollars,$,complete
16580,,NIPPON YUSEN KAISHA,TIFFIN,COMMERCIAL,EN ROUTE ABOARD SS KOBE MARU,BROADSIDE; 5.5 X 7.75;,handwritten; red border;,DAILY MENU;,1900-4398,,,1900-09-18,Nippon Yusen Kaisha,,,,complete
34280,Waldorf Astoria,Waldorf Astoria,,,,21.5x13.5cm,,,1914-0982_wotm,,,1914-10-20,Waldorf Astoria,,Dollars,$,complete
33635,Waldorf Astoria,Waldorf Astoria,,,,24x20.5cm folded; 24x41cm open,honor leigon of the police department,,1914-0094_wotm,,,1914-01-22,Waldorf Astoria,,,,complete
29399,,Que Pasta's,,,,21.5x18cm folded; 21.5x35.5cm open,,,1988-0001_wotm,,,1988-01-01,Que Pasta's,,Dollars,$,complete
28094,,Fairmont Hotel And Tower,,,,36x23cm folded; 36x46cm open,,,1966-0044_wotm,,,1966-11-29,Fairmont Hotel And Tower,,,,complete
20788,,EMPIRE HOTEL,CHRISTMAS DINNER,COMMERCIAL,BATH (ENGLAND?),CARD; ILLUS; 5 X 8;,menu in french; ornamental border; two different menus for the same date;,,1907-1107,,,1907-12-26,Empire Hotel,,,,complete
25296,,ADOLF MEHRKENS MANNERCHOR,DINNER,?,"HAMBURG,GERMANY",BROADSIDE;ILLUS;COL;4X5.75;,menu in german,?,1891-019,,,1891-02-14,Adolf Mehrkens Mannerchor,,,,complete
16871,,HAMBURG-AMERIKA LINIE,DINNER,COMMERCIAL,"SCHNELLDAMPFER ""AUGUSTE VICTORIA""",BROADSIDE; ILLUS; COL; 9X6.75;,"german & english; sea scene on cover; includes ""musik programm;""",,1900-2559,,,1900-03-24,Hamburg Amerika Linie,,,,complete
28773,,Phillips Express,,,,21.5x9cm folded; 21.5x27cm open,,,1987-0097_wotm,,,1987-01-01,Phillips Express,,Dollars,$,complete
30524,,The Starlight Roof Of The Waldorf Astoria,,,,23x15.5cm folded; 23x30.5cm open,,,1941-0071_wotm,,,1941-12-09,The Starlight Roof Of The Waldorf Astoria,,,,complete
23033,,RUTGERS COLLEGE ALUMNI ASSOCIATION OF THE CITY OF NEW YORK,ANNUAL DINNER,EDUC;,"PLAZA, THE",BOOKLET; ILLUS; COL; 5X7.6;,"menu in french; includes a la carte champagne; speakers, officers, directors listed; college seal on cover;",ANNIVERSARY;,1908-150,,,1908-02-14,Rutgers College Alumni Association Of The City Of New York,,,,complete
12923,,ALBEMARLE HOTEL,MENU,COMMERCIAL,"MADISON SQUARE, WEST, NEW YORK, NY",FOLDER; ILLUS; COL; 6X8.5;,a la carte priced menu; hotel seal on cover;,,1900-2026,,,1900-02-22,Albemarle Hotel,,Dollars,$,complete
23333,,HOTEL PONCE DE LEON,DINNER,COMMERCIAL,"ST. AUGUSTINE, FL",CARD; 5 X 9;,logo;,,1901-183,,,1901-01-25,Hotel Ponce De Leon,,,,complete
31140,,Hotel Astor,,,,34x23cm,,,1933-0189_wotm,,,1933-04-29,Hotel Astor,,Dollars,$,complete
35184,Astor House,Astor House,,,,,dinner to martin green,,1913-0412_wotm,,,1913-04-26,Astor House,,Dollars,$,complete
31030,,Worcester Country Club,,,,13x15cm folded; 13x30cm open,,,1938-0148_wotm,,,1938-06-23,Worcester Country Club,,,,complete
15578,,,,,,,,,,,,1901-04-26,Proctor's Cafe,,Dollars,$,complete
29033,,Im Haus Der Kunst,,,,25x13cm,,,1964-0038_wotm,,,1964-11-25,Im Haus Der Kunst,,Deutsche Marks,DM,under review
20208,,NORDDEUTSCHER LLOYD BREMEN,DINNER,COMMERCIAL,EN ROUTE ABOARD DAMPFER FRIEDRICH DER GROSSER,FOLDER ILLUS; COL; 5.25 X 7.5;,menu in german and english;; illustration of steamer; musical program;,,1901-1843,,,1901-07-04,Norddeutscher Lloyd Bremen,,,,complete
29547,,Schrafft's,,,,24x18.5cm folded; 24x27cm open,,,1955-0094_wotm,,,1955-08-24,Schrafft's,,Dollars,$,complete
25425,,COMPAGNIE GENERAL TRANSATLANTIQUE,DINNER,COMMERCIAL,ABOARD PAQUEBOT LA TOURAINE,CARD; ILLUS; COL; 6 X 8;,menu in french and english; photos of steamer and cathedral; pale blue border;,,1907-306,,,1907-03-16,Compagnie General Transatlantique,,,,complete
32908,Hotel Manhattan,Hotel Manhattan,,,,28x18cm folded; 28x36cm open,,,1917-0648_wotm,,,1917-11-23,Hotel Manhattan,,Dollars,$,complete
29628,,Eden Roc Pavilion,,,,25.5x20cm folded; 25.5x39.5cm open,,,1955-0024_wotm,,,1955-05-12,Eden Roc Pavilion,,Francs,FF,complete
15660,,,,,,,,,,,,1900-05-28,Pacific Mail Steamship Company,,,,complete
13912,,RUSSELL HOUSE,TABLE D'HOTE,COMMERCIAL,"DETROIT, MI",BROADSIDE; ILLUS; COL; 4.5X7.0;,purple paper; double imperial eagle with coronets in gold; elves frolicking in white; menu on white paper glued to the purple background;,,1900-3868,,,1900-07-11,Russell House,,,,complete
33568,[Restaurant name and/or location not given],[Restaurant name and/or location not given],,,,16.5x11cm folded; 16.5x22cm open,"complimentary dinner by new york press club to the officers of the ""gregory""",,1914-0027_wotm,,,1914-01-09,[Restaurant name and/or location not given],,,,complete
25135,,LAS CORPORACIONES ECONOMICAS UNIDAS,DINNER IN HONOR OF DR.D.GABRIEL CASUSO,GOV;,"HAVANA,CUBA",FOLDER;ILLUS;COL;4.5X7.25;,menu in french;wines listed for each course;,COMPLIMENTARY/TESTIMONIAL,1905-695,,,1905-09-07,Las Corporaciones Economicas Unidas,,,,complete
16677,,NIPPON YUSEN KAISHA,[DINNER],COMMERCIAL,ABOARD SS KAMAKURA MARU;,BROADSHEET; ILLUS; COL; 10.5X9.5;,"hand written; illus, basket of crysanthemums; reverse side, map of indian ocean showing the steamer tracks of the nippon yusen kaisha;",,1900-4095,,,1900-08-19,Nippon Yusen Kaisha,,,,complete
34608,Waldorf-Astoria: South Gate,Waldorf-Astoria: South Gate,,,,,dinner given to the president of the united states his cabinet and the officers of the atlantic fleet,,1912-0792_wotm,,,1912-11-28,Waldorf-Astoria: South Gate,,Dollars,$,complete
25509,,DAMASRUS COMMANDERN NO.58,"RECEPTION TO SIR JAMES S.MANNING,GRAND SWORD-BEARER,GRAND COMMANDERN OF THE STATE OF NY;",SOC;,"EVERETT'S, [BROOKLYN,NY]",FOLDER;5X7.25;,menu in french;,COMPLIMENTARY/TESTIMONIAL,1894-049,,,1894-05-02,Damasrus Commandern No.58,,,,complete
33024,[Restaurant name and/or location not given],[Restaurant name and/or location not given],,,,53x21.5cm,,,1917-0764_wotm,,,1917-12-01,[Restaurant name and/or location not given],,Dollars,$,complete
30899,,Waldorf Astoria,,,,21x14cm folded; 21x28cm open,beth el hospital,,1938-0076_wotm,,,1938-05-22,Waldorf Astoria,,,,complete
27411,,"NORDDEUTSCHER LLOYD, BREMEN",REGULAR MENU,STEAMSHIP,ABOARD  PRINZ FRIEDRICH WILHELM'',CARD; ILLUS; COL; 8X5.5,geran english; picture of castle on mountain,BREAKFAST,1910-981,,,1910-03-19,"Norddeutscher Lloyd, Bremen",,,,complete
20446,,PACIFIC MAIL STEAMSHIP COMPANY,DINNER,COMMERCIAL,SS CITY OF RIO DE JANEIRO,FOLDER;ILLUS;COL;5.5X8.75;,decorative border;ship at sea;,DAILY MENU;,1900-3828,,,1900-07-05,Pacific Mail Steamship Company,,,,complete
14029,,OREGON SHORT LINE DINING CAR SERVICE,SUPPER,COMMERCIAL,EN ROUTE,CARD; ILLUS; COL; 5.5X7.25;,a la carte menu; rr logo at top; oregon scenery on back; [date handwritten];,,1901-2428,,,1901-09-01,Oregon Short Line Dining Car Service,,Dollars,$,complete
13082,,DEUTSCHE GESANDTSCHAFT,[LUNCH],GOVT;,"PETROLOLIS,[BRAZIL]",CARD;ILL;3.75X7;,date and items of food written by hand;embossed coat of arms center top;,DAILY;,1900-2116,,,1900-02-25,Deutsche Gesandtschaft,,,,complete
32691,Louis Sherry,Louis Sherry,,,,26.5x15cm folded; 26.5x30cm opened,menu also printed in french,,1917-0428_wotm,,,1917-11-13,Louis Sherry,,Dollars,$,complete
21726,,HOTEL ST. GEORGE,SUNDAY MENU,,"[BROOKLYN, NY]",BROADSHEET,"handwritten vegetable entered,wine list on back",,1885-032,,,1885-12-27,Hotel St. George,,Dollars,$,complete
19473,,,,,,,,,,,,1900-01-01,Northern Steamship Company/Great Northern Ry Line.,,Dollars,$,complete
24128,,THE COLONIAL CLUB,FORMAL OPENING OF THE NEW HOUSE,SOC;,NY,BOOKLET ILLUS;4.75X7.5,booklet; illus.cover;menu in french;,DINNER,1892-131,,,1892-11-15,The Colonial Club,,,,complete
17765,,,,,,,,,,,,1900-07-01,Hotel Velvet,,,,under review
30195,,Banff Springs Hotel,,,,27.5x20.5cm folded; 27.5x41cm open,,,1939-0147_wotm,,,1939-06-30,Banff Springs Hotel,,Dollars,$,complete
24730,,HAMBURG-AMERIKA LINIE,LUNCH,COMMERCIAL,EN ROUTE ABOARD SCHNELLDAMPFER AUGUSTE VICTORIA,CARD; ILLUS; COL; 4.75 X 8;,menu in german and english; illustration of steamship and woman in classical dress surrounded by fruits; city in background;,,1901-366,,,1901-02-14,Hamburg Amerika Linie,,,,complete
23305,,GRAND LODGE OF MASSACHUSETTS,FEAST OF SAINT JOHN THE EVANGELIST,SOC;,"MASONIC TEMPLE,BOSTON [MA]",CARD;COL;4.25X7.25;,"wines served;handwritten notes ""500 people"" and a signature;",RELIGIOUS HOLIDAY,1899-908,,,1899-12-27,Grand Lodge Of Massachusetts,,,,complete
28559,,The Dayton Biltmore   Kitty Hawk Room,,,,42x28cm,,,1957-0097_wotm,,,1957-01-01,The Dayton Biltmore   Kitty Hawk Room,,Dollars,$,complete
27283,,Park Lane,brunch,"HOTEL,RESTAURANT",Park Lane,folder; 7.25 x 9.5 inches,"baratta collection; illustrations (cover, interior); chef specialties; wine suggestions; $5.00 per person; printed in the netherlands by kühn en zoon (rotterdam)",,Baratta 9,,,1959-04-26,Park Lane,,Dollars,$,complete
28448,,Peterhof Gaststätten,,,,30x21cm folded; 30x42cm open,,,1958-0096_wotm,,,1958-12-20,Peterhof Gaststätten,,Deutsche Marks,DM,under review
20720,,TOYO KISEN KAISHA,DINNER,COMMERCIAL,EN ROUTE ABOARD HONG KONG MARU,BROADSHEET; ILLUS; 6.5 X 7.75;,"b&w photographs of various points of interest in america, hawaii, china;japan;",DAILY MENU;,1900-4359,,,1900-09-13,Toyo Kisen Kaisha,,,,under review
27117,,Tao Yuan Restaurant,daily menu,RESTAURANT,Tao Yuan Restaurant,9 x 5 1/2 in. fold.,includes insert of printed chinese characters.,,Soete 80,,,1939-01-01,Tao Yuan Restaurant,,Dollars,$,complete
31122,,Hotel Astor,,,,34x23cm,,,1933-0171_wotm,,,1933-04-16,Hotel Astor,,Dollars,$,complete
24596,,ABSCHIEDS-KRANZCHEN DER SECTION BERN DES GENFER-VEREINS,DINNER,SOC(?);,"HOTEL-ANGESTELLEN, INNERN-ENGE(?)",FOLDER; 4.5 X 6.75;,menu is in french; remainder of folder in german,OTHER (SOC);,1895-155,,,1895-09-30,Abschieds Kranzchen Der Section Bern Des Genfer Vereins,,,,complete
13029,,CUNARD LINE,BREAKFAST,COMMERCIAL,"R.M.S. ""ETRURIA""",CARD; ILLUS; COL; 4.25X6.5;,steamship co. priced wine list on back; company flag at top of menu;,,1900-2273,,,1900-03-04,Cunard Line,,,,complete
27559,,Norddeutscher Lloyd Bremen,Norddeutscher Lloyd Bremen & Dinner,,,,,,1910-733 ItemA&B,,,1910-03-10,Norddeutscher Lloyd Bremen,,,,complete
32579,Union Club,Union Club,,,,17x14.5cm folded; 17x29cm open,,,1918-0312_wotm,,,1918-11-27,Union Club,,,,complete
22512,,NEW HAMPSHIRE CLUB,DINNER,,"YOUNG'S HOTEL, BOSTON,MASS",BROADSIDE; ILLUS; COL; 4.25 X 7;,,,1897-302,,,1897-11-10,New Hampshire Club,,,,complete
33797,Terrace Garden,Terrace Garden,,,,26x16cm folded; 26x32 cm open,"amsterdam grocery company, inc.",,1914-0254_wotm,,,1914-02-18,Terrace Garden,,,,complete
21180,,COMMERCIAL ORGANIZATIONS OF SAN FRANCISCO,"BANQUET IN HONOR OF THE CHICAGO COMMERCIAL CLUB AND IT GUESTS FROM THE BOSTON, CINCINNATI & ST. LOUIS COMMERCIAL CLUBS",COMMERCIAL,"MARK HOPKINS INSTITUTE OF ART, SAN FRANCISCO, CA",BOOKLET; ILLUS; COL; 5.5X8;,"california wines & moet chandon, pommery, roederer served with individual courses; members of chicago club & their guests listed; also listed: executive committee & individual san francisco  organizations; handpainted flowers decorate food part of menu; s",COMPLIMENTARY/TESTIMONIAL,1901-679,,,1901-03-16,Commercial Organizations Of San Francisco,,,,under review
29986,,The Brass Rail,,,,38x25.5cm folded; 38x51cm open,,,1949-0076_wotm,,,1949-12-23,The Brass Rail,,Dollars,$,under review
12982,,BERT HOUGH & TONY FRANKER - PABST BLUE RIBBON,DINNER,COMMERCIAL,"CHICAGO ,ILL",BROADSIDE; ILLUS; COL; 5.25 X 7.75;,,EVENING DINNER,1900-2483,,,1900-03-16,Bert Hough & Tony Franker   Pabst Blue Ribbon,,Dollars,$,complete
29230,,La Colombe D'or,,,,28x21.5cm; digitize copy 1,french is secondary language,,1995-0002_wotm,,,1995-01-30,La Colombe D'or,,,,complete
23820,,HAMBURG-AMERIKA LINIE,DINNER,COMMERCIAL,"SCHNELLDAMPFER ""AUGUSTE VICTORIA""",FOLDER; ILLUS; COL; 4.5X6.75;,german & english; illustration of athens; musical program on back;,,1901-698,,,1901-03-19,Hamburg Amerika Linie,,,,complete
20926,,TOYO KISEN KAISHA,BREAKFAST,COMMERCIAL,EN ROUTE ABOARD HONG KONG MARU,BROADSHEET; ILLUS; 6.5 X 7.75;,"b&w photographs of various points of interest in america, hawaii, china;japan;",DAILY MENU;,1900-4701,,,1900-10-15,Toyo Kisen Kaisha,,Dollars,$,complete
12738,,SAVOY HOTEL,LUNCH,COMMERCIAL,"[LONDON,ENGLAND]",CARD;ILL;COL;4.25X7;,egyptian water side scene with a spray of flowers on top and a single flower on bottom left;french menu;date in french;london written by hand;,DAILY;,1900-1180,,,1900-02-20,Savoy Hotel,,,,complete
32211,Hotel McAlpin,Hotel McAlpin,,,,25.5x18cm folded; 25.5x36cm open,,,1916-0126_wotm,,,1916-08-13,Hotel McAlpin,,,,complete
34246,Waldorf Astoria,Waldorf Astoria,,,,21.5x13.5cm,,,1914-0948_wotm,,,1914-10-02,Waldorf Astoria,,Dollars,$,complete
34640,Waldorf-Astoria,Waldorf-Astoria,,,,,new york state hotel association,,1912-0824_wotm,,,1912-01-01,Waldorf-Astoria,,,,complete
14155,,M.F.LYONS,LUNCH AND DINNER,COMMERCIAL,"259 BOWERY, NEW YORK",FOLDER; 7 X 11;,priced wine list and menu;,,1906-1032,,,1906-12-31,M.F.Lyons,,Dollars,$,complete
29791,,Empire Tea Room,,,,29x23cm folded; 29x46cm open,,,1946-0020_wotm,,,1946-02-11,Empire Tea Room,,Dollars,$,complete
15577,,,,,,,,,,,,1901-04-26,E.B. Orcutt Restaurant And Cafe,,Dollars,$,complete
23829,,TAMPA BAY HOTEL,DINNER,COMMERCIAL,"TAMPA, FL",FOLDER; 4.5 X 7.5;,logo;,,1901-371,,,1901-02-14,Tampa Bay Hotel,,,,complete
16653,,OCEANIC STEAMSHIP COMPANY,LUNCHEON - SECOND CABIN,COMMERCIAL,EN ROUTE ABOARD SONOMA,CARD; 5.5 X 7;,logo;,,1901-1251,,,1901-05-12,Oceanic Steamship Company,,,,complete
25164,,CHICAGO BEACH HOTEL,LUNCH,COMMERCIAL,[CHICAGO IL?],CARD; 4.5 X 7.25;,notes that there is a hop that evening in ladies' parlor,,1893-084,,,1893-07-14,Chicago Beach Hotel,,,,complete
32848,Fleischmann's Vienna Restaurant,Fleischmann's Vienna Restaurant,,,,31x20cm folded; 31x40cm open,,,1917-0149_wotm,,,1917-10-23,Fleischmann's Vienna Restaurant,,Dollars,$,complete
17466,,,,,,,,,,,,1900-02-13,Empire Hotel,,Dollars,$,complete
18448,,,,,,,,,,,,1900-06-06,Occidental & Oriental Steamship Company,,,,complete
30540,,Pallister Hotel,,,,13.5x8cm,afternoon tea,,1937-0014_wotm,,,1937-01-01,Palliser Hotel,,Canadian Dollars,C$,complete
22586,,KENSINGTON HOTEL,BREAKFAST,COMMERCIAL,5TH AVE. & 15TH ST. NY,BROADSIDE; 6.5 X 10.25;,some item handwritten; all prices listed;,DAILY,1900-391,,,1900-01-18,Kensington Hotel,,Dollars,$,complete
35344,Travers Island,Travers Island,,,,,new york athletic club,,1913-0572_wotm,,,1913-06-14,Travers Island,,Dollars,$,complete
20419,,PACIFIC MAIL STEAMSHP COMPANY,DINNER,COMMERCIAL,SS CITY OF PARA,FOLDER;5.5X8.75;,handwritten on printed form;mechanically reproduced;2 copies,DAILY;,1900-3245,,,1900-05-12,Pacific Mail Steamshp Company,,,,complete
35303,St. Denis Hotel,St. Denis Hotel,,,,,south african dinner,,1913-0531_wotm,,,1913-05-29,St. Denis Hotel,,Dollars,$,complete
23618,,MAXIM'S,DINNER,COMMERCIAL,"PARIS,FRANCE",BROADSIDE;ILLUS;COL;9.75X13;,all item priced in french;,DAILY;,1906-657,,,1906-08-04,Maxim's,,Francs,FF,complete
21543,,CORNELL UNIVERSITY ALUMNI,TWENTIETH ANNUAL DINNER,EDUC;,"WALDORF-ASTORIA HOTEL, NEW YORK, NY",BOOKLET; ILLUS; COL; 5.5X7;,"french; ""wines a la carte;"" toasts; entertainment committee listed;",OTHER (REUNION);,1900-537,,,1900-01-26,Cornell University Alumni,,,,complete
35447,Waldorf Astoria,Waldorf Astoria,,,,,3 images,,1913-0678_wotm,,,1913-08-25,Waldorf Astoria,,Dollars,$,complete
28298,,American Festival Café,,,,28x22cm folded; 28x43cm open,,,1984-0007_wotm,,,1984-11-22,American Festival Café,,Dollars,$,complete
32405,The Biltmore,The Biltmore,,,,28x18cm folded; 28x36cm open,us food administration rationing suggestions,,1918-0011_wotm,,,1918-01-05,The Biltmore,,Dollars,$,under review
21336,,NEW HAVEN COLONY HISTORICAL SOCIETY,BANQUET IN CELEBRATION OF WASHINGTON'S FIRST INAUGURATION,PROF;,NEW HAVEN CT,CARD; 4.5 X 6.75;,menus used as place card; city noted by fnb;,ANNIVERSARY;,1899-400,,,1899-05-01,New Haven Colony Historical Society,,,,complete
24156,,MAPLEWOOD HOTEL,BREAKFAST MENU,COMMERCIAL,"WHITE MOUNTAINS, NH",BROADSHEET; 5.25X6.25;,very heavy selections for breakfast!,,1892-099,,,1892-07-01,Maplewood Hotel,,,,complete
26630,,Restaurant Allard,,"FOREIGN,RESTAURANT","Restaurant Allard, 41 Rue Saint-Andre-des-Arts, France","Folder, paper, 5.25 x 7.25 inches","dieter zander collection; one menu item is listed for each day of the week, monday through saturday",,Zander 652,,,,Restaurant Allard,,,,under review
26767,,La Grande Cascade,Daily,"FOREIGN,RESTAURANT",La Grande Cascade,Booklet; 11.5 x 16.75 inches,dieter zander collection; illustrated covers; exterior scene spans both back and front covers; signed by author; includes laminated drink menu and prix fixe menu,,Zander 613,,,,La Grande Cascade,,Francs,FF,complete
28408,,Chickland,,,,29x21.5cm folded; 29x42.5cm open,,,1958-0056_wotm,,,1958-09-18,Chickland,,Dollars,$,complete
20304,,LONG BEACH HOTEL,DINNER,COMMERCIAL,"LONG BEACH, L.I, NY",BROADSIDE; ILLUS; 5X8;,hotel logo at top of menu;,,1900-4004,,,1900-08-05,Long Beach Hotel,,,,complete
14386,,ROYAL PALACE HOTEL,DINNER,COMMERCIAL,"ATLANTIC CITY, NJ",CARD; ILLUS; COL; 4X9.75;,sketch of woman at top;,,1901-2065,,,1901-07-28,Royal Palace Hotel,,,,complete
23281,,CITY VIGILANCE LEAGUE,"COMPLIMENTARY DINNER TENDERED TO REV. CHARLES H. PARKHURST, D.D.",PROF;,"JAEGER'S, NEW YORK, NY",BOOKLET; ILLUS; 4.5X6.5;,"photo of guest of honor on cover; includes guest & committee list, alos separate booklet of table plan",COMPLIMENTARY/TESTIMONIAL,1894-110,,,1894-11-27,City Vigilance League,,,,complete
17026,,MILLS HOTEL,DAILY MENU,COMMERCIAL,"BLEECKER STREET, NEW YORK",BROADSHEET; 3.75 X 6;,commutation tickets; tables reserved for ladies;,,1900-2587,,,1900-03-28,Mills Hotel,,,,complete
25873,,N.A.P.D.,DINNER,SOC(?);,"THE NEW WILLARD, WASHINGTON, DC",FOLDER; COL; 5 X 7.25;,cocktails and wines; literary quotes;toasts;,ANNIVERSARY (?);,1906-466,,,1906-05-15,N.A.P.D.,,,,complete
23058,,LESLIE M. SHAW (SECRETARY OF THE TREASURY?),DINNER TO PRESIDENT THEODORE ROOSEVELT,SOC;,THE ARLINGTON (WASHINGTON DC?),CARD; 5 X 7;,wines with each course; u.s. crest; sponsor and event noted by feb;,COMPLIMENTARY/TESTIMONIAL,1906-030,,,1906-01-09,Leslie M. Shaw (Secretary Of The Treasury?),,,,complete
28579,,Arnold's Turtle Vegetarian Café,,,,37x23cm folded; 37x45cm open,,,1985-0015_wotm,,,1985-01-01,Arnold's Turtle Vegetarian Café,,Dollars,$,complete
19979,,NORDDEUTSCHER LLOYD - BREMEN,BREAKFAST,COM,"EN ROUTE - SS ""LAHN""",CARD; ILLUS; COL; 5.5 X 8.25;,menu in both german & english;,,1901-1239,,,1901-05-11,Norddeutscher Lloyd   Bremen,,,,complete
32730,Pennsylvania Railroad,Pennsylvania Railroad,,,,21.5x11cm,,,1917-0467_wotm,,,1917-11-15,Pennsylvania Railroad,,Dollars,$,complete
33917,Waldorf Astoria,Waldorf Astoria,,,,23x14cm folded; 23x28cm open,,,1914-0618_wotm,,,1914-06-18,Waldorf Astoria,,Dollars,$,complete
33510,Waldorf Astoria,Waldorf Astoria,,,,,,,1915-0249,,,1915-01-01,Waldorf Astoria,,Dollars,$,complete
32676,Louis Sherry,Louis Sherry,,,,26.5x15cm folded; 26.5x30cm opened,menu also printed in french,,1917-0413_wotm,,,1917-11-12,Louis Sherry,,Dollars,$,complete
31162,,The Ambassador,,,,28x35.5cm,,,1933-0348_wotm,,,1933-06-07,The Ambassador,,Dollars,$,complete
15349,,,,,,,,,,,,1901-05-20,Oceanic Steamship Company   Sonoma,,,,complete
32625,Healy's Forty-second Street restaurant,Healy's Forty-second Street restaurant,,,,33x18cm,luncheon,,1918-0358_wotm,,,1918-03-09,Healy's Forty-second Street restaurant,,Dollars,$,complete
15923,,,,,,,,,,,,1900-12-13,Union College Alumni Association Of New York,,Dollars,$,complete
17125,,HOTEL CHAMPLAIN,DINNER,COMMERCIAL,"CLINTON,NY",CARD; ILLUS; COL; 5.25X8.5,emblem; buildings on hilltop;,DAILY;,1901-2170,,,1901-08-17,Hotel Champlain,,,,complete
20041,,NIPPON YUSEN KAISHA,TIFFIN,COMMERCIAL,EN ROUTE ABOARD SS.K0BE MARU,BROADSHEET;5.5X7.75;,handwritten;green border;,DAILY MENU;,1900-4749,,,1900-10-19,Nippon Yusen Kaisha,,,,complete
